source_code,source_display,translated_text,back_sim,cand1_code,cand1_label,cand1_score,cand2_code,cand2_label,cand2_score,cand3_code,cand3_label,cand3_score,cand4_code,cand4_label,cand4_score,cand5_code,cand5_label,cand5_score,suggested_relationship,final_score,curator_id,comment
TNA1.1,Mānta Valippu,Manta Valippu. Seizures caused due to digestive disorders,100.0,DD93,"This group incorporates functional gastrointestinal disorders in infants and toddlers and disorders diagnosed more often in school-aged children and adolescents. These disorders include a variable combination of often age-dependent, chronic or recurrent symptoms not explained by structural or biochemical abnormalities.",59.11,,,,,,,,,,,,,review,59.11,,
TOD1.1,Mānta Caṉṉi,Manta Ca Ca nhi. Seizures Caused due to Digestive Disorders.,94.92,DD93,"This group incorporates functional gastrointestinal disorders in infants and toddlers and disorders diagnosed more often in school-aged children and adolescents. These disorders include a variable combination of often age-dependent, chronic or recurrent symptoms not explained by structural or biochemical abnormalities.",59.58,,,,,,,,,,,,,review,59.58,,
UA,Pal Nōykaḷ,Pal Noyka. dental disease,97.71,DA0A.3,dental root,73.58,DA08.0,Dental caries,73.52,MG30.61,Chronic dental pain associated with irreversible pulpitis,65.58,QA00.8,Dental examination,52.39,XE5CY,Dental care products,50.92,related-to,73.58,,
UAA1.1,Pal Kūccam,Pal Kukkam.SensitiveTeeth,92.96,XA6CZ2,Teeth,60.43,,,,,,,,,,,,,review,60.43,,
UAA1.3,Pallāṭṭam,Pallāṭṭam.Weak dentition,100.0,XA4GG3,Permanent dentition,63.86,XA7675,Deciduous dentition,61.75,,,,,,,,,,review,63.86,,
UAA1.5,Kuṭṭippal,Kuṭṭippal. Wisdom Tooth,100.0,XA1PT3,Parts of tooth,70.69,DA07.3,Turner tooth,70.1,DA08.3,Horizontal nontraumatic fracture of tooth,64.95,DA0E.3,abnormal spacing of tooth or teeth,63.66,NA0D.15,Exarticulation. Complete displacement of the tooth out of its socket.,63.49,related-to,70.69,,
UB,PallaṭI Nōykaḷ,Pallāṭi Nōyka | Gum disease,98.28,XM1J98,Karaya (gum),68.21,XM1FG7,Sweet gum,67.68,XM1A07,Gum-tree,63.1,2B63,Malignant neoplasms of gum,51.14,XM6DW9,Guar gum (medicinal),45.02,review,68.21,,
UBA1.5,Pallaṭi Vīkkam,Pallaṭi Vīkkam.Gingivitis,100.0,DA0B.0,Allergic gingivitis,69.42,DA0B.2,Eruptive gingivitis,68.53,DA0B.1,Catarrhal gingivitis,66.43,DA0B.3,Atrophic senile gingivitis,64.43,DA0D.4,Cotton-roll gingivitis,61.58,review,69.42,,
WAA1.4,Veḷi Curam,Veuli Karam.Fever due to,81.3,MG26,fever,85.28,1C33,Q fever,78.36,1A08,Enteritis due to paratyphoid fever A,74.11,1C11.1,Meuse fever,73.86,1C11.00,Oroya fever,72.42,review,50.14,,
WAB1.22,Cērkkai Curam,Cērkkai Karam. Fever caused due to increased lust,94.86,9C61.2B,Glaucoma caused by increased episcleral venous pressure,57.52,,,,,,,,,,,,,review,57.52,,
WAB1.4,Naḷir Curam,Naurir Karam.Fever with chills,88.62,MG21,Chills,83.5,SD93,Alternating fever and chills disorder (TM1),61.03,,,,,,,,,,review,61.03,,
WAC1.5,Manta Curam,Manta Curam.Fever caused due to digestive disorders,100.0,DD93,"This group incorporates functional gastrointestinal disorders in infants and toddlers and disorders diagnosed more often in school-aged children and adolescents. These disorders include a variable combination of often age-dependent, chronic or recurrent symptoms not explained by structural or biochemical abnormalities.",60.08,,,,,,,,,,,,,review,60.08,,
WBC1.5,Vintu Curam,Vintu Karam.Fever with shrinking of male genital organ,95.97,NB99,Injury to male genital organ without further specification,64.71,,,,,,,,,,,,,review,64.71,,
X,Ciṟunīraka Nōykaḷ,Ciunīraka Nōyaka.Uro genital disorders,94.16,GB08,Vascular disorders of male genital organs,63.13,,,,,,,,,,,,,review,63.13,,
XCA,Vaḷi,Vai.Anuria classified under Vali,98.31,NF0A.5,"Traumatic anuria, not elsewhere classified",67.67,,,,,,,,,,,,,review,67.67,,
YAA,Vaḷi,Vali.Toxic symptoms classified under Vali,98.85,XE2PR,"Venomous or toxic plant, not elsewhere classified",61.43,,,,,,,,,,,,,review,61.43,,
YAB,Aẕal,A chiral.Toxic symptoms classified under Azhal,90.23,XE2PR,"Venomous or toxic plant, not elsewhere classified",56.75,,,,,,,,,,,,,review,56.75,,
YAC,Aiyam,Aiyam.Toxic symptoms classified under Aiyam,98.9,XE2PR,"Venomous or toxic plant, not elsewhere classified",59.32,,,,,,,,,,,,,review,59.32,,
YAD,Mukkuṟṟam,Mukkuam.Toxic symptoms classified under Mukkutram,97.33,XE2PR,"Venomous or toxic plant, not elsewhere classified",53.81,,,,,,,,,,,,,review,53.81,,
YD17,Elikkaṭi Nañcu,Elikkaṭi Nañcu. Poisonous effect of rat bite,100.0,1B90,Rat-bite fevers,72.82,,,,,,,,,,,,,related-to,72.82,,
YF48,Uṇavuttōṭa Nañcu,Uṇavuttōṭa Nañcu.Toxic effects due to food poisoning,100.0,XE13E,Poisoning or toxic effect of exposure to substance,63.43,,,,,,,,,,,,,review,63.43,,
Z#16,Veṟi,Vei.Aggravated aiyam leading to Catatonia,98.65,MB45.2,Atonia,57.86,,,,,,,,,,,,,review,57.86,,
Z$12,Iratta Pittam,Iratta Pittam.Hypertension,100.0,DB98.7,Portal hypertension,74.83,BB01.0,heritable pulmonary arterial hypertension,74.53,JA22.0,Gestational proteinuria without hypertension,74.25,9C61.01,Ocular hypertension,73.3,JA23,gestational [pregnancy-induced] hypertension without significant proteinuria,72.98,related-to,74.83,,
Z$17,Karappāṉ Pittam,Karappā Pittaam Dermatitis,96.14,EK11,Occupational protein contact dermatitis,71.02,9A06.7,Eczematous blepharitis and contact dermatitis affecting the eyelids.,70.16,ED90.1,Childhood granulomatous periorificial dermatitis,69.83,EK00,Allergic contact dermatitis is an eczematous response provoked by a Type IV delayed immune reaction in the skin to a substance or substances to which the individual has previously been sensitized.,69.58,EA85.3,Dermatitis (eczema) involving predominantly the feet.,69.38,review,59.52,,
Z$17,Karappāṉ Pittam,Karappā Pittaam Dermatitis,96.14,EK11,Occupational protein contact dermatitis,71.02,9A06.7,Eczematous blepharitis and contact dermatitis affecting the eyelids.,70.16,ED90.1,Childhood granulomatous periorificial dermatitis,69.83,EK00,Allergic contact dermatitis is an eczematous response provoked by a Type IV delayed immune reaction in the skin to a substance or substances to which the individual has previously been sensitized.,69.58,EA85.3,Dermatitis (eczema) involving predominantly the feet.,69.38,related-to,71.02,,
Z$22,Tuṭi Pittam,Tuṭi Pittam. palpitation and tremors in the body parts,100.0,VW21,Caring for body parts,72.15,ND72.6,Asphyxia on mucous in bronchioles,63.69,NC52.10,Laceration without foreign body of other parts of wrist or hand,57.56,NC52.11,Laceration with foreign body of other parts of wrist or hand,57.11,ND70.2,Foreign body in multiple parts of external eye,53.61,related-to,72.15,,
Z$31,Kapāla Pittam,Kapāla Pittam.Pain in the cranium and face,100.0,MG31.0,"Acute pain in the face, not elsewhere classified",58.05,,,,,,,,,,,,,review,58.05,,
Z18,Neṟṟicūlai Vātam,Neicūlai Vātam.Glucoma,92.13,MB20.1,Coma,61.88,,,,,,,,,,,,,review,61.88,,
Z30,Urakāri Vātam,Urakāri Vātam. liver abscess,100.0,XA5DY0,Liver,84.69,DB90.0,Abscess of liver,79.33,1A36.10,Amoebic liver abscess,73.76,SA04,Liver abscess disorder (TM1),66.6,,,,review,66.6,,
Z31,Asvatampa Vātam,Asvatampa Vātam.TB Spine,100.0,FA72.1,Kissing spine,69.17,XA7AB8,Spine of helix,67.33,XA2EN5,Tibial spine,67.23,XA8V32,Anterior longitudinal ligament of the spine,63.59,ND50,"multiple fractures of spine, level unspecified",62.5,review,69.17,,
Z40,Mūttira Utira Vātam,Mūttira Utira Vātam. bladder carcinoma,100.0,2C94.2,Non-papillary transitional cell carcinoma of the bladder,72.29,2E68,Carcinoma in situ of bladder,71.44,2C94.1,Squamous cell carcinoma of bladder,64.47,,,,,,,related-to,72.29,,
Z42,Cavviraṅka Vātam,Cavvira ̄ ka Vatam. aggregation of vatha and dyspepsial symptoms,96.3,MD92,"A condition characterised by upper abdominal symptoms that suggest indigestion (painful, difficult, or disturbed digestion), which may include pain or discomfort of upper abdomen, bloating, feeling of fullness with very little intake of food, nausea and vomiting, heartburn, loss of appetite.",63.19,,,,,,,,,,,,,review,63.19,,
Z48,Kaṇṭakirākavātam,Kaṇṭakirākavātam. hypertrophy heart diseases,100.0,BC20,"Chronic rheumatic heart diseases, not elsewhere classified",50.59,,,,,,,,,,,,,review,50.59,,
Z52,Karppacūlai Vātam,Karppacūlai Vātam.Lower abdominal pain with accumulation of blood in uterus,100.0,SF99,Blood heat build up in the uterus pattern (TM1),69.06,,,,,,,,,,,,,review,69.06,,
Z52,Karppacūlai Vātam,Karppacūlai Vātam.Lower abdominal pain with accumulation of blood in uterus,100.0,SF99,Blood heat build up in the uterus pattern (TM1),69.06,,,,,,,,,,,,,review,69.06,,
Z54,Kuṭal Vātam,Kuṭal Vātam. hernia,100.0,LB00.0,congenital diaphragm hernia,73.18,LB13.1,Congenital diaphragmatic hernia,70.81,DD50.0,Congenital diaphragmatic hernia,70.81,DD52,Bilateral femoral hernia NOS,70.02,DD56,ventral hernia with gangrene,69.06,related-to,73.18,,
Z61,Vātacurōṇitam,Vatakurōṇitam.Polyarthritis,96.74,FA24.1,"Juvenile idiopathic polyarthritis, rheumatoid factor positive",74.38,,,,,,,,,,,,,related-to,74.38,,
Z78,Cantirā Varttam Nōkkāṭu,Cantir Varttam Nokkku Maxillary ethmoidal sinusitis,93.37,XA7VK5,Maxilla,60.34,,,,,,,,,,,,,review,60.34,,
Z85,Tanta Vāyu,Tanta Vayu.Pain in Tooth,100.0,XE4YS,Ant,60.22,,,,,,,,,,,,,review,60.22,,
ZAA1.4,Kuṉmacūlai,Ku ku macūlai.Pain in the abdomen,92.23,XA6GV0,Abdomen,83.41,VV12,pain in the hip,80.08,MC18,pain in eye,77.41,FB56.4,Pain in limb,76.84,ME84.0,pain in neck,76.23,review,58.77,,
ZAC1.4,Nitampacūlai,Nitampaculai. muscular growth in the auterus,100.0,XA99N3,Uterus,59.4,,,,,,,,,,,,,review,59.4,,
